{
  "schema_version": "1.2",
  "batch_id": "0192f3c1-8a44-7c1e-9b31-2f5c0a3d77e4",
  "sent_at": "2026-09-10T12:05:00.311Z",
  "producer": {
    "name": "vigil",
    "version": "0.1.0"
  },
  "host": {
    "host_id": "b7f1c0a93e5d4821bb2f6c1d9e0a7f34",
    "install_id": "0192e7aa-1c02-7f10-8d44-9a1b6c2e5f03",
    "boot_id": "6f2c1d84-9b3a-4c77-8e21-0f5a2b6c9d18",
    "hostname": "web-03",
    "os": {
      "family": "linux",
      "distro": "debian",
      "version": "12",
      "kernel": "6.1.0-18-amd64",
      "arch": "x86_64"
    },
    "addresses": [
      "10.0.0.13"
    ],
    "tags": {
      "host_id_source": "/etc/machine-id"
    }
  },
  "findings": [
    {
      "event_id": "0192f3c2-3c66-7d24-9b30-7e9f4c0d5a32",
      "finding_key": "agent.budget|cpu",
      "kind": "agent.budget.exceeded",
      "severity": "medium",
      "state": "open",
      "observed_at": "2026-09-10T12:04:58.104Z",
      "first_seen_at": "2026-09-10T12:04:58.104Z",
      "occurrences": 1,
      "title": "This agent costs 2.13 % of one core, over the 1 % it is allowed",
      "subject": {
        "type": "agent",
        "key": {
          "part": "cpu"
        }
      },
      "evidence": [
        {
          "kind": "note",
          "value": "the share of one core is the average of the last 8 readings of each collector divided by that collector's period, summed over the collectors. The ceiling is 1 % of one core"
        },
        {
          "kind": "cost",
          "value": "network · 1.90 % of one core · every 30 s · 570.0 ms per reading · 2 slot(s) missed"
        },
        {
          "kind": "cost",
          "value": "users · 0.23 % of one core · every 300 s · 690.0 ms per reading"
        },
        {
          "kind": "schedule",
          "value": "reading less often is a decision for a person to take, so this agent does not take it. To take it, put this in the configuration:\nschedule:\n  network: 64\n  users: 639\n"
        }
      ],
      "rule": "agent_budget"
    }
  ]
}
